,시,구,업종명,가게명,년,월,전체평점,맛 평점,양 평점,배달 평점,리뷰 내용
0,서울특별시,중구,분식,신전떡볶이-퇴계로점,2021,4,5,5,5,5,맛있고 빨라요 국물이 다 흘러서 왔지만 다음엔 순한맛 시켜볼게요
0,서울특별시,중구,분식,신전떡볶이-퇴계로점,2021,4,5,5,5,5,너무 맛있어요 일주일 한번 시켜먹는 최고의 떡뽁이 맛집
0,서울특별시,중구,분식,신전떡볶이-퇴계로점,2021,4,5,5,5,5,맛있어요^^ 신전떡볶이 순한맛이 딱 맛있네요
0,서울특별시,중구,분식,신전떡볶이-퇴계로점,2021,4,5,5,5,5,"신전은 오리지널이 최고 인듯,, 그래도 한번쯤 먹어볼 맛 !"
0,서울특별시,중구,분식,신전떡볶이-퇴계로점,2021,4,5,5,5,5,"떡볶이 별로 안좋아하는데, 여기는 가끔 시켜먹어요!! 진짜 맛있어욥:)"
0,서울특별시,중구,분식,신전떡볶이-퇴계로점,2021,4,5,5,5,5,신전로제는 처음인데 맛있게 잘 먹었어요!!
0,서울특별시,중구,분식,신전떡볶이-퇴계로점,2021,4,5,5,5,5,"1인분 배달 넘 좋아요! 궁물 많이주셔서 좋습니다. 치즈는 거리가 있다보니까 좀 굳어서 왔고, 튀김은 옷이 매우 얇아서 맛있었어요. 바삭함보다는 부드러운맛? 치킨마요컵밥은 치킨이 좀더 있었으면 합니다. 전반적으로 맛있게 잘먹었습니다~"
0,서울특별시,중구,분식,신전떡볶이-퇴계로점,2021,4,5,5,5,5,배달겁나 빠르고 로제떡볶이 JMT
0,서울특별시,중구,분식,신전떡볶이-퇴계로점,2021,4,5,5,5,5,순한맛인데 딱 적다히 맵고 맛있네요~!
0,서울특별시,중구,분식,신전떡볶이-퇴계로점,2021,4,5,5,5,5,"신전 로제,,,, 기대한만큼 맛있어요..."
0,서울특별시,중구,분식,신전떡볶이-퇴계로점,2021,4,5,5,5,5,로제떡볶이 진짜 맛있네요. 다른데 로제도 먹어봤는데 여긴 질리지않는 맛이에요! 안에 치즈 들어간 김밥도 너무 맛있어요 다음에 또 시켜먹을거에요~!!
0,서울특별시,중구,분식,신전떡볶이-퇴계로점,2021,4,5,5,5,5,로제떡볶이 맛있어용👍 고구마치즈볼 먹어보고 싶었는데 오늘 처음 먹어보네용ㅎㅎ 자주 시켜먹겠습니다 오뎅튀김 리뷰서비스 감사합니다~~~😍😍
0,서울특별시,중구,분식,신전떡볶이-퇴계로점,2021,4,5,5,5,5,와 십오분만에 왔어요 매운맛 시켜서 후하후하하며 먹었지만 완전 맛있습니다! 다음엔 중간맛 시켜야지..... 신전 오리지널도 맛난데 로제도 너무 맛있어요. 추천!
0,서울특별시,중구,분식,신전떡볶이-퇴계로점,2021,4,5,5,5,5,역시 신전.. 로제 국물 딘짜 맛있어요..드링킹함ㅋㅋㅋㅋㅋㅋㅋㅋㅋ서비스로 주신 튀김도 굿굿!
0,서울특별시,중구,분식,신전떡볶이-퇴계로점,2021,4,5,5,5,5,너무 맛있네용 (ˊo̶̶̷ᴗo̶̶̷`) 국물이 많아요 로제가 원래 그런가요? ㅎㅎㅎ 국물 좋아하시면 시켜드세요 ! 배달도 짱 빠릅니다 ㅎㅎㅎ또 먹을게요 ‧⁺◟( ᵒ̴̶̷̥ ·̫ ᵒ̴̶̷̣ )
0,서울특별시,중구,분식,신전떡볶이-퇴계로점,2021,4,5,5,5,5,오랜만에 신전 시켜먹었는데 역시 맛있어요. 요즘 떡볶이도 다 혼자시키기 부담스러운데 신전은 혼자먹기 너무 좋은거같아요ㅠ 그리고 최소주문금액도 9천원이어서 부담도 없어요. 감사합니다
0,서울특별시,중구,분식,신전떡볶이-퇴계로점,2021,4,5,5,5,5,역시는 역시입니당! 맛있어용
0,서울특별시,중구,분식,신전떡볶이-퇴계로점,2021,4,5,5,5,5,퇴계로점은 처음 주문해봤는데 맛있었어요~~ 배달도 빠르고요~~
0,서울특별시,중구,분식,신전떡볶이-퇴계로점,2021,4,5,5,5,5,신떡은 역시 맛있고 좋아요 한결같은 존맛
0,서울특별시,중구,분식,신전떡볶이-퇴계로점,2021,4,5,5,4,5,로제 처음먹어보는데 최고에요
0,서울특별시,중구,분식,신전떡볶이-퇴계로점,2021,4,5,5,5,5,역시 신전은 치즈김밥
0,서울특별시,중구,분식,신전떡볶이-퇴계로점,2021,4,4,4,5,5,양도 많고 맛있어서 계속 땡기는 맛이에요
0,서울특별시,중구,분식,신전떡볶이-퇴계로점,2021,4,5,5,5,5,"여러 브랜드의 로제 뚝볶이를 먹어봤지만, 이곳이 최고입니다."
0,서울특별시,중구,분식,신전떡볶이-퇴계로점,2021,4,5,5,5,5,맛있게 잘 먹었습니다!!
0,서울특별시,중구,분식,신전떡볶이-퇴계로점,2021,4,5,5,5,5,진짜 미친맛이에요 너무 맛있어요ㅠㅠ무조건 드세요 진짜로
0,서울특별시,중구,분식,신전떡볶이-퇴계로점,2021,4,5,5,5,5,너무 중독적이라 무서움
0,서울특별시,중구,분식,신전떡볶이-퇴계로점,2021,4,5,5,5,5,캬.. 포장깔끔하고 배달하시는분이 친절하시네요.. 배달도 빠르고 맛도 쥑이네요. 감사합니다.
0,서울특별시,중구,분식,신전떡볶이-퇴계로점,2021,3,5,5,5,5,맛있어요 배불러요 !!!
0,서울특별시,중구,분식,신전떡볶이-퇴계로점,2021,3,5,5,5,5,완전 맛있어용! 또 시킬게용
0,서울특별시,중구,분식,신전떡볶이-퇴계로점,2021,3,5,5,5,,맛있게 잘 먹었어요.
0,서울특별시,중구,분식,신전떡볶이-퇴계로점,2021,3,4,4,4,4,주문이 안들어가 늦게 오긴 했지만 잘 먹었습니다
0,서울특별시,중구,분식,신전떡볶이-퇴계로점,2021,3,5,5,5,5,자주 시켜먹어르요 맛있어요
0,서울특별시,중구,분식,신전떡볶이-퇴계로점,2021,3,5,5,5,5,"와 진짜 3명이서 배터질정도로 먹었어요,, 감사합니다 배달도 빨라서 좋았어요!!"
0,서울특별시,중구,분식,신전떡볶이-퇴계로점,2021,3,5,5,5,5,언제나 맛있어용! 또 시킬게용!
0,서울특별시,중구,분식,신전떡볶이-퇴계로점,2021,3,5,5,5,5,너무 맛있어요!!!
0,서울특별시,중구,분식,신전떡볶이-퇴계로점,2021,3,5,4,4,4,맛있게 잘먹었습니다!
0,서울특별시,중구,분식,신전떡볶이-퇴계로점,2021,3,5,5,5,5,"1인분씩 개별 포장도 해주시고, 포장도 깔끔하고 물론 맛도 최고👍 입니다. 강추강추 고민하지 마시고 바로 주문하세요^^"
0,서울특별시,중구,분식,벌떡떡볶이-금호점,2021,7,5,5,5,5,맛있게 잘 먹었습니다
0,서울특별시,중구,분식,벌떡떡볶이-금호점,2021,7,5,5,5,5,로제떡볶이넘먹고싶어서 시켜먹어보ㅏ요 양도많고맛있네요~~~!!! 근데 맵기강도 중간선택햇는데 쫌맵네요ㅠㅠㅠㅋㅋ 불닭즐겨먹는 사람인데도 약간매웠어용ㅠㅠ!
0,서울특별시,중구,분식,벌떡떡볶이-금호점,2021,7,3,3,3,3,맛잇어서 저녁에 한번씩 시켜먹엇엇는데 이번에는 낮에 시켜서 그런지 .. 주먹밥이 진짜 작아서 몰랫어요 ; 원래 안그럇엇는데
0,서울특별시,중구,분식,벌떡떡볶이-금호점,2021,6,5,5,5,5,배달빠르고 양도푸짐하구 맛도좋네요 엽떡만 먹었는데 오늘부로 갈아탑니다
0,서울특별시,중구,분식,벌떡떡볶이-금호점,2021,6,5,5,5,5,맛있어요~맛있어요~
0,서울특별시,중구,분식,벌떡떡볶이-금호점,2021,5,4,4,5,5,"배달도 굉장히 빠르고, 맛도 양도 넘 좋고, 국물을 많이 주셔서 남은걸로 밥도 먹었어요. 감사합니다~^^"
0,서울특별시,중구,분식,벌떡떡볶이-금호점,2021,5,4,4,3,4,항상 떡이 좀 적어서 떡 추가 했는데도 ㅠ 조금 적은 것 같아욤 ㅜㅜ 하지만 항상 맛있어서 자주 시켜 먹습니다 ~!
0,서울특별시,중구,분식,벌떡떡볶이-금호점,2021,5,5,5,5,5,맛있네요~~처음이지만
0,서울특별시,중구,분식,벌떡떡볶이-금호점,2021,4,5,5,5,5,매운맛이 좀 덜해졋지만 맛나요ㅎㅎ
0,서울특별시,중구,분식,벌떡떡볶이-금호점,2021,4,3,3,3,5,맛은 별로였고 너무 매웠어요
0,서울특별시,중구,분식,벌떡떡볶이-금호점,2021,4,5,5,5,5,진짜 맛있어요 우리동네 떡볶이집 중에 제일 맛있어요
0,서울특별시,중구,분식,벌떡떡볶이-금호점,2021,3,5,5,5,5,맛있고 편리함 !!
0,서울특별시,중구,분식,벌떡떡볶이-금호점,2021,3,5,5,5,5,언제나 맛나고 좋아요. 배달도 빠르고요.
0,서울특별시,중구,분식,치즈밥있슈-성균관점,2021,4,5,4,5,5,양이 많아 좋네요 1인분주문도 가능해서 좋았어요 주문양이 많았음에도 불구하고 배달 시간도 알맞게 도착했습니다^^
0,서울특별시,중구,분식,치즈밥있슈-성균관점,2021,4,5,5,5,5,맛잇게 잘 먹엇읍니다 부대찌갶ㅎㅎ
0,서울특별시,중구,분식,빠삭이닭강정-신당본점,2021,7,5,5,5,5,요기요익스프레스 그 쿠폰 있어서 시켜본건데 와 리얼 개존맛 양도 망ㅎ고 완전 빠삭하고 20분만에 왔어요 ㅠㅠㅠㅠ 또 시켜먹을게요 💗💗
0,서울특별시,중구,분식,빠삭이닭강정-신당본점,2021,7,5,5,5,5,매번 맛있게 잘 먹고있습니다!
0,서울특별시,중구,분식,빠삭이닭강정-신당본점,2021,7,5,5,5,5,아이들과 맛있게 먹었어요
0,서울특별시,중구,분식,빠삭이닭강정-신당본점,2021,7,5,5,5,5,"비오는 날도 바삭하네욥!! 처음 시켜봤는데 떡두 냉동맛 안 나서 좋구 후라이드에다 소금, 닭강정 소스 찍어먹을수도 있어서 좋아요~"
0,서울특별시,중구,분식,빠삭이닭강정-신당본점,2021,7,5,5,5,5,맛있어요~~~~!!!!
0,서울특별시,중구,분식,빠삭이닭강정-신당본점,2021,7,5,5,5,5,항상 존맛탱 :) 감사히 잘 먹었습니다
0,서울특별시,중구,분식,빠삭이닭강정-신당본점,2021,7,5,5,5,5,여기 닭강정은 진짜👍👍 아이들때문에 늘 후라이드로 시키고 양념은 따로 받는데요~ 기름이 깨끗한지 강정색도 너무 좋고 매운맛 염지도 되어있지않아서 아이들도 잘먹어요! 특히 아이들에게는 떡이 인기가 좋네요^^ 이번에는 특대 시켰는데 남아서 시간이 흘러서 먹어도 너무 맛있어요!(떡은 시간이 지나면 굳으니 되도록 제때 다 먹기로해요🙂) 순살이구 부드럽구요♡ 꼭 국내산 닭 먹어야해!!가 아니시면 아이들 있는 집에 강추 드립니다☺ 매운맛 소스는 꽤 매운편이니 맵찔분들은 순한맛 추천해요☺
0,서울특별시,중구,분식,빠삭이닭강정-신당본점,2021,7,5,5,5,5,맛있어요 매주 먹어줘야함
0,서울특별시,중구,분식,빠삭이닭강정-신당본점,2021,7,5,5,5,5,바삭촉촉 맛있습니다..!
0,서울특별시,중구,분식,빠삭이닭강정-신당본점,2021,7,5,5,5,5,매번 맛있게 먹고 있어요
0,서울특별시,중구,분식,빠삭이닭강정-신당본점,2021,7,5,5,5,5,처음시켜먹었는데 양도많고 바삭하니 정말 맛나게 먹었습니다. 손편지도 감동 입니다. 다음에 또 시킬께요.
0,서울특별시,중구,분식,빠삭이닭강정-신당본점,2021,7,5,5,5,5,완변합니다 너무 맛있어요
0,서울특별시,중구,분식,빠삭이닭강정-신당본점,2021,7,5,5,5,5,양도 맛도 좋고 깔금해요
0,서울특별시,중구,분식,빠삭이닭강정-신당본점,2021,7,5,5,5,5,이렇게 바삭한 닭강정은 처음 먹어보는 것같아요. 정말 맛있네요:) 번창하세요.
0,서울특별시,중구,분식,빠삭이닭강정-신당본점,2021,6,5,5,5,5,최고입니다 저번에 랭킹1위라고 닭강정 먹었는데 정말 슬펐는데 여기는 고민 없이 주문할꺼 같아요
0,서울특별시,중구,분식,빠삭이닭강정-신당본점,2021,6,5,5,5,5,배달도 빠르고 추가 떡 서비스도 주시고 맛도 괜찮습니다
0,서울특별시,중구,분식,빠삭이닭강정-신당본점,2021,6,5,5,5,5,배달 진짜빠르고 엄청 맛있어요! 양도 엄청나게 많이 주셔서 다먹고 운동 엄청 열심히했네요 ㅋㅋㅋㅋㅋ 앞으로 자주 시켜먹울게요 번창하세요!
0,서울특별시,중구,분식,빠삭이닭강정-신당본점,2021,6,5,5,3,4,원래는 배달민으로 배달시켜먹는 제 최애맛집입니다. 배달민에서 배달안해줘서 요기요로 시켰는데 양이 적어진 느낌ㅠㅠ 배달원이 빼먹는건 아니겠죠?
0,서울특별시,중구,분식,빠삭이닭강정-신당본점,2021,5,5,5,5,5,양도 많고맛도아주 좋아요
0,서울특별시,중구,분식,빠삭이닭강정-신당본점,2021,5,5,5,5,5,맛있었어요 배달도 빠르고 양도 많이 주셨어요 감사합니다~
0,서울특별시,중구,분식,빠삭이닭강정-신당본점,2021,5,5,5,5,5,맛있고 배달도 빨라요~~~~~
0,서울특별시,중구,분식,빠삭이닭강정-신당본점,2021,5,5,5,4,5,맛나고 깔큼하고 좋아요
0,서울특별시,중구,분식,빠삭이닭강정-신당본점,2021,5,5,5,5,5,오랜만에 시켰는데 역시 맛있었어요! 다만 전보다 튀김이 바삭하지 않아 아쉬웠습니다ㅜㅜ 전에는 다 식어도 바삭했는데 식으니까 눅눅해지더라구요ㅜㅜ 그래도 역시 닭다리살이라 만족스러웠습니다! 또 주문할게요~~
0,서울특별시,중구,분식,빠삭이닭강정-신당본점,2021,5,5,5,5,5,따로 떡 서비스도 주시고 배달도 빠르고 첫주문인데 감동이네요~ 맛도 부드러우면서 바삭바삭해요
0,서울특별시,중구,분식,빠삭이닭강정-신당본점,2021,4,4,4,4,4,넘 맛잇어요 고소해요!
0,서울특별시,중구,분식,빠삭이닭강정-신당본점,2021,4,5,5,5,5,"맛,양, 배달속도 너무 완벽!!"
0,서울특별시,중구,분식,빠삭이닭강정-신당본점,2021,4,5,5,5,5,원래 리뷰 같은거 잘안다는데 맛있어서 달게 된 건 처음이에요 순한맛으로 먹었는데 정말 정말 맛있게 잘먹었습니다
0,서울특별시,중구,분식,빠삭이닭강정-신당본점,2021,4,5,5,5,5,양 많고 맛있어요~~ 빠삭~
0,서울특별시,중구,분식,빠삭이닭강정-신당본점,2021,4,5,5,5,5,오랜만에 시켰는데 역시 너무 맛있어요! 튀김이 진짜 빠식한데 튀김옷이 두껍지도 않습니다! 무엇보다 배달이 진짜 빠르고 배달기사님도 너무 친절하세요! 다음에 또 시켜먹을게요~
0,서울특별시,중구,분식,빠삭이닭강정-신당본점,2021,4,5,5,5,5,양도 맛도 최고~~~!!!
0,서울특별시,중구,분식,빠삭이닭강정-신당본점,2021,4,5,5,5,5,튀김이 정말 고소하고 바삭해요 양념묻혀도 맛있지만 후라이드로 먹어도 존맛탱
0,서울특별시,중구,분식,빠삭이닭강정-신당본점,2021,4,5,5,5,5,어머님댁에 보내드렸어요. 맛있데요 바 삭하고. 다른곳보다 양도많고.. 돈이 아깝지않음
0,서울특별시,중구,분식,빠삭이닭강정-신당본점,2021,4,5,5,5,5,맛있어요.. 항상요곳만먹는데 가끔 타이밍 잘못걸리면.. 먹고싶어도 먹을수없는게 아쉬워요.
0,서울특별시,중구,분식,빠삭이닭강정-신당본점,2021,4,5,5,5,5,이런거 잘 안남기는데 친절한 메모에 감동받아 남깁니다. 번창하세요^^
0,서울특별시,중구,분식,빠삭이닭강정-신당본점,2021,4,4,4,5,5,"양이 많네요. 먹을땐 별로 안맵다싶었는데 좀 있다 매운맛이 올라와요. 튀김옷이 두껍지않은게 좋고, 좀 덜 달았음 좋겠어요"
0,서울특별시,중구,분식,빠삭이닭강정-신당본점,2021,3,5,5,5,5,양도 많고 여럿이서 잘먹었습니다 양념도 괜찮고 맵기도 좋네요 ~
0,서울특별시,중구,분식,빠삭이닭강정-신당본점,2021,3,5,4,5,5,맛도 맛이지만 사장님 진짜 친절하시구 배달도 빠르고 양도 많아요 그리고 깨끗한 느낌이어서 좋앗어요
0,서울특별시,중구,분식,빠삭이닭강정-신당본점,2021,3,5,5,5,5,완전 바삭해서 더 맛있어요.
0,서울특별시,중구,분식,빠삭이닭강정-신당본점,2021,3,5,5,5,5,무야호~~~~~~~~
0,서울특별시,중구,분식,빠삭이닭강정-신당본점,2021,3,5,5,5,5,개꿀맛 ㄷ ㄷ 틀딱같네 ㄷ ㄷ 너무 맛있어요
0,서울특별시,중구,분식,빠삭이닭강정-신당본점,2021,3,5,5,5,5,떡도 쫄깃하고 닭강정도 바삭해서 너무 맛나요~~
0,서울특별시,중구,분식,빠삭이닭강정-신당본점,2021,3,5,5,5,5,맛도 서비스도 모두 좋았어요! 주소가 뒷건물로 잘못찍혀서 기사님께 죄송했는데 친절히 응대해주셔서 감사했습니다!
0,서울특별시,중구,분식,빠삭이닭강정-신당본점,2021,3,5,5,5,5,맛있게 잘 먹었습니다!
0,서울특별시,중구,분식,빠삭이닭강정-신당본점,2021,3,4,4,5,5,양념보다 후라이드가 맛있었어요~
0,서울특별시,중구,분식,빠삭이닭강정-신당본점,2021,3,5,5,5,5,토끼 너무 귀여워요 ㅋㅋㅋㅋ바삭해서 완전 취향저격 요청사항 잘 들어주셔서 감사합니다❤️❤️❤️❤️
0,서울특별시,중구,분식,빠삭이닭강정-신당본점,2021,3,5,5,5,5,너무 맛나요. 바삭하구.
0,서울특별시,중구,분식,빠삭이닭강정-신당본점,2021,3,5,5,5,5,항상 맛있게 잘 먹고있습니다~!
0,서울특별시,중구,분식,빠삭이닭강정-신당본점,2021,3,5,5,5,5,맛있어요!! 완전추천합니다!!
0,서울특별시,중구,분식,빠삭이닭강정-신당본점,2021,3,5,5,5,5,양도 많고 딱 적당하게 매워서 너무 좋았어요!
0,서울특별시,중구,분식,빠삭이닭강정-신당본점,2021,3,5,5,5,5,그냥 맛있어요 애들은 후라이드를 더 좋아하네요 토욜먹었는데 이틀만에 또 시켜달라네요 5분순삭
0,서울특별시,중구,분식,빠삭이닭강정-신당본점,2021,3,5,5,5,5,"빠삭하고 달달한 닭강정 맛있게 잘 먹었습니다! 순한맛 시켰는데, 달달하고 바삭한 닭강정에 은은하고 약한 매콤한 느낌이 들어 물리지 않고 맛있게 먹었어요!"
0,서울특별시,중구,분식,빠삭이닭강정-신당본점,2021,3,5,5,5,5,양이 많고 바삭하게 맛있어서 좋습니다
0,서울특별시,중구,분식,빠삭이닭강정-신당본점,2021,3,5,5,5,5,서비스로 떡도 넉넉히 넣어주시구 잘먹을게요~
0,서울특별시,중구,분식,빠삭이닭강정-신당본점,2021,3,5,5,5,5,이름값 합니다 완전 빠삭하고 맛있어요😭
0,서울특별시,중구,분식,빠삭이닭강정-신당본점,2021,3,5,5,5,5,바삭하고 배달빨라요^^
0,서울특별시,중구,분식,빠삭이닭강정-신당본점,2021,3,5,5,5,5,매번 시켜 먹는데  맛있네요!!
0,서울특별시,중구,분식,빠삭이닭강정-신당본점,2021,3,5,5,5,5,맛있고 배달도 빠르고 양도 넉넉하게 더 주셔서 자주 시켜먹고있습니다~ 👍🏻👍🏻👍🏻
0,서울특별시,중구,분식,빠삭이닭강정-신당본점,2021,3,5,5,5,5,"배달도 굉장히 빨랐지만, 정성스런 손글씨와 맛에 감동입니다. 소스도 맵지않고 적당히 단맛이었고.. 남은건 오늘 점심에 먹었는데도 눅눅하지않고 바삭해서 먹기좋았어요.. 양도 푸짐해서 이틀에걸쳐먹었고, 서비스로넣어주신 떡은 남편이 더 좋아하네요.. 감사히 잘먹었습니다..번창하세요 ^^"
0,서울특별시,중구,분식,빠삭이닭강정-신당본점,2021,3,5,5,5,5,가성비갑👍 뭣보다 빠삭한 식감이 넘 좋아요. 근데 요기요주문이 거의 안되요ㅠㅠ 오늘은 운좋게 먹었습니다. 맛있게잘 먹었습니다~~^^
0,서울특별시,중구,분식,빠삭이닭강정-신당본점,2021,3,5,5,5,5,"와 진짜 리뷰 안남기는 사람인데 이정도 가격에 이정도 맛,양 본적이 없습니다 양이 이진짜 먹어도 먹어도 끝이없고 맛있고 최곱니다!!"
0,서울특별시,중구,분식,빠삭이닭강정-신당본점,2021,3,5,5,5,5,맛잇게 잘 먹엇어용
0,서울특별시,중구,분식,빠삭이닭강정-신당본점,2021,3,5,5,5,5,배달 빠르고 바삭 바삭 맛있어요
0,서울특별시,중구,분식,뎁짜이,2021,7,5,5,5,5,가끔 시켜먹는데 맛있습니다. 약간 숙취가 있어서 쌀국수 먹으니 속이 확 풀어지네요^^
0,서울특별시,중구,분식,뎁짜이,2021,7,5,5,5,5,"#식후감 #환경지킴이 😎뎁짜이 분자는...제가 만난 분짜 중 최고였어요. 🕶😊분짜의 4요소인 면, 고기, 야채, 소스, 모두 훌륭합니다. 탱글한 면에 새콤한 소스, 아삭한 야채, 고소한 고기. 한 입 한 입이 베트남 그 자체에요. 🤠 그리고 요청사항을 잘 읽어주셔서 더 좋아요. 일회용품, 먹지 않는 밑반찬이 다 빠져서 오니 마음이 한결 편해요.👏👏👏"
0,서울특별시,중구,분식,뎁짜이,2021,6,5,5,5,5,훌륭하네요 잘 먹었습니다
0,서울특별시,중구,분식,뎁짜이,2021,6,5,5,5,1,맛은 제가 좋아하는 맛이예요. 요청사항 들어주셔서 감사합니다. 맛있어요. 정신 없이 먹다가 찍엇네요. 다만 엑스프레스 않해도 될 듯 한데요. 어차피 배달이 30분 넘어서 올거면요.
0,서울특별시,중구,분식,뎁짜이,2021,6,5,5,5,5,정신없이 먹다가 다 먹고 찍었네요. 맛있어요.
0,서울특별시,중구,분식,뎁짜이,2021,6,5,5,5,5,단체주문도 친절하게 응해주시고 맛도 너무좋아서 두번째 시켰어요. 지난번에 볶음밥정말 맛있게먹었는데 이번에 분짜도 최고!!! 직원들이 뎁짜이 식사 진짜 좋아해요~~
0,서울특별시,중구,분식,뎁짜이,2021,5,5,5,5,5,한달만에 시켜먹은 것 같네요 예전에 비하면 오랜만에 먹었는데 양도 가득하고 늘 맛있어요~~
0,서울특별시,중구,분식,뎁짜이,2021,5,5,5,5,5,쌀국수는 여기서만 시켜먹어요 최고!!!!
0,서울특별시,중구,분식,뎁짜이,2021,5,5,5,5,5,마라맛은 싫고 담백한 맛에 그냥 맵게 정도만 먹을려고 빨간 고추를 이번에도 부탁하고 저번에도 부탁했는데 한번도 안주시네요. 빨간 고추가 비싸서 그런건가요?
0,서울특별시,중구,분식,뎁짜이,2021,5,4,4,5,5,"맛있고, 양도 적당했어요. 배달이 정말 빨리 도착해서 깜짝 놀랐어요~ 처음에 먹을땐 심심한 건강한 맛이고 먹을수록 아래에 있는 자작한 굴물의 양념이 베어 달짝한게 맛있었습니다. 베트남 특유의 피쉬소스 맛이 좀 덜한게 아쉬워요. 소스를 따로 주시면 기로에 맞게 넣어 먹음 좋을듯 합니다."
0,서울특별시,중구,분식,뎁짜이,2021,5,5,5,5,5,넘 맛있게 잘먹었어요!!ㅎㅎㅎ 다음에 또 시킬게요!!
0,서울특별시,중구,분식,뎁짜이,2021,5,5,5,5,5,좋습니다~~~~~~
0,서울특별시,중구,분식,뎁짜이,2021,5,4,4,5,5,다진 마늘. 빨간 고추를 더 달라 했는데 주지도 않았고 일회용 숟가락 젖가락은 싫다고 했는데 넣으셨네요. 요청 사항은 아예 안보시나 봐요? 샌드위치 맛은 그냥 그랫어요.
0,서울특별시,중구,분식,뎁짜이,2021,5,4,5,5,5,분보남보를 정말 먹고싶었는데....
0,서울특별시,중구,분식,뎁짜이,2021,5,5,5,5,5,양 많고 맛있어요 잘 먹었습니다
0,서울특별시,중구,분식,뎁짜이,2021,5,5,5,5,5,가게에 가서도 몇번 먹었는데 역시나 맛있음.
0,서울특별시,중구,분식,뎁짜이,2021,5,5,5,5,5,입맛이 없을 때 항상 시켜먹는 매뉴~좋아요
0,서울특별시,중구,분식,뎁짜이,2021,5,5,5,5,5,따뜻하고 맛있어요. 금새 왔습니다
0,서울특별시,중구,분식,뎁짜이,2021,4,5,5,5,5,항상믿고먹습니당 존맛탱
0,서울특별시,중구,분식,뎁짜이,2021,4,5,5,5,5,맛있었어요 리뷰 믿고 시켰는데 정말이네요 또 주문할게요
0,서울특별시,중구,분식,뎁짜이,2021,4,5,5,5,5,생면이라 맛있어요 약간 심심한데 국물이 진해요
0,서울특별시,중구,분식,뎁짜이,2021,4,5,5,5,5,항상 맛있게 먹고 있어요
0,서울특별시,중구,분식,뎁짜이,2021,4,5,5,5,5,배달 엄청 빨라서 놀랐어요 ㅎㅎ 맛 짱!~~%~!!! 담에 또 시켜먹을게요
0,서울특별시,중구,분식,뎁짜이,2021,4,5,5,5,5,반 덜어 먹고 다음날 반 끓여 먹었습니다 진한 국물이 늘 일품이에요
0,서울특별시,중구,분식,뎁짜이,2021,4,5,5,5,5,항상 믿고 시키는 곳입니다! 면도 탱글탱글하고 육수도 맛있어요~
0,서울특별시,중구,분식,뎁짜이,2021,4,5,5,5,5,초고속 배송은.기본 맛은.top 실망시키지않는 뎁짜이
0,서울특별시,중구,분식,뎁짜이,2021,4,5,5,5,5,양 많고... 맛있어요 특히 넴짜조가 맛잇어요
0,서울특별시,중구,분식,뎁짜이,2021,4,5,5,5,5,언제나처럼 맛있어요!! 짜조 소스 바뀐 거 너무 좋아요!
0,서울특별시,중구,분식,뎁짜이,2021,4,5,5,5,5,분보남보를 처음 시켜봤어요 늘 맛있게 먹고 있습니다 😊
0,서울특별시,중구,분식,뎁짜이,2021,4,5,5,5,5,여기는 찐 맛집입니다. 언제 직접가서 먹어봐야겠어요
0,서울특별시,중구,분식,뎁짜이,2021,3,5,5,5,5,10번째 시켜 먹은 분짜에요
0,서울특별시,중구,분식,뎁짜이,2021,3,5,5,5,5,9번째 분짜와 처음 시켜본 마라쌀국수 ! 둘 다 너무 맛있는데 안데친면 요청했는데 데친면으로 왔어요 😭
0,서울특별시,중구,분식,뎁짜이,2021,3,5,5,5,5,맛나유~~~~~~~
0,서울특별시,중구,분식,뎁짜이,2021,3,5,5,5,5,맛있어요!배달도 빨라요^^
0,서울특별시,중구,분식,뎁짜이,2021,3,4,4,5,5,무난한 맛이예요 ㅎㅎ
0,서울특별시,중구,분식,뎁짜이,2021,3,5,5,5,5,너무 맛있어요!!!!!!!!
0,서울특별시,중구,분식,뎁짜이,2021,3,5,5,5,5,맛있게 잘먹고 있습니다
0,서울특별시,중구,분식,뎁짜이,2021,3,5,5,5,5,8번째 분짜네요 😋
