,시,구,업종명,가게명,년,월,전체평점,맛 평점,양 평점,배달 평점,리뷰 내용
0,서울특별시,중구,분식,이명근떡볶이,2021,4,5,5,5,5,여기 사장님 떡볶이 맛에 진심인게 느껴짐 이제껏 배달만 시켰지만 지나가는 길에 보면 가게도 깨끗한게 정직해 보임 혹시라도 분점들이 생기게 된다면 놀랄 것 같지 않음
0,서울특별시,중구,분식,이명근떡볶이,2021,4,5,5,5,5,배달도 빠르고 맛도 있어요^^
0,서울특별시,중구,분식,이명근떡볶이,2021,4,5,5,5,5,맛있게 먹고있어요~^^♥
0,서울특별시,중구,분식,이명근떡볶이,2021,4,5,5,5,5,별점 5점이라 궁금해서 시켜 봤어요.. 근데 왜 5점인지 알 것 같아요.. 여자 둘이서 가장 기본 배부르게 먹고 살짝 남았어요 한 2.5인분? 정도 되는 것 같아요! 매운맛은 15세 이상이라 써있어서 기대 안했는데 꽤 매콤해서 너무 좋았습니다... 배달도 빠르고 맛있고 가격도 저렴하고.. 빠지는 데가 없네요 앞으로 자주 시키게 될 것 같습니다^^
0,서울특별시,중구,분식,이명근떡볶이,2021,4,5,5,5,5,"옛날 떡볶이 느낌나고, 맛도있고 양도 많고 야끼만두도 맛있고 ㅎㅎ 오랜만에 떡볶이맛집"
0,서울특별시,중구,분식,이명근떡볶이,2021,4,5,5,5,5,맛있네요. 양도많고
0,서울특별시,중구,분식,이명근떡볶이,2021,4,5,5,5,5,배달 엄청 빠르고 맛있어요! 즉석떡볶이 같은 맛 이랄까요? 떡볶이는 사랑입니다♡
0,서울특별시,중구,분식,이명근떡볶이,2021,4,5,5,5,5,매장에서 먹는거랑 똑같이 맛있네요! 배달도 빠르게 왔고 잘먹었습니당ㅎㅎ
0,서울특별시,중구,분식,이명근떡볶이,2021,3,5,5,5,5,배달료 프로모션에 리뷰 이벤트에 저렴하고 맛있게 잘 먹었습니다
0,서울특별시,중구,분식,이명근떡볶이,2021,3,5,5,5,5,배달도 빠르고 어묵도 많아서 좋았어요! 달콤한 떡볶이맛이라 좋았어요!
0,서울특별시,중구,분식,이명근떡볶이,2021,3,5,5,5,5,맛있게 잘먹었습니다! 감사합니다
0,서울특별시,중구,분식,이명근떡볶이,2021,3,5,5,5,5,맛있네요 라면사리가 바닥에 숨어있어용
0,서울특별시,중구,분식,이명근떡볶이,2021,3,5,5,5,5,왜 술안주 하신다는지 알겠네요 적당히 달고 매콤한 국물이 일품입니다 다음에 술안주로 시킬게요 잘 먹었습니다 서비스도 감사합니다
0,서울특별시,중구,분식,이명근떡볶이,2021,3,5,5,5,4,떡볶이 자극적이지 않고 넘 맛있어요!! 양도 많거 혜자입니다 가까이 있었음 자주 시켜먹었을텐데 배달료가 비싼게 넘남 아쉬워요ㅠㅠ
0,서울특별시,중구,분식,이명근떡볶이,2021,3,3,4,3,3,맛은 괜찮은데 먹고나서 배가 좀 아프고 설사를 좀 했어요 ㅜㅜ
0,서울특별시,중구,분식,이명근떡볶이,2021,3,5,5,5,5,배달 정말 빠르고 이번에 처음 먹어봤는데 우선 떡이 넘 제스타일이라 좋아요. 맵찔이한테는 좀 맵지만 맛있게 매운맛이라 콧물 흘리며 열심히 먹었습니다. 매콤한데 또 생각나는 맛이에요. 다음엔 튀김이랑 같이 먹어봐야겠어요
0,서울특별시,중구,분식,이명근떡볶이,2021,3,5,5,5,5,맛나요! 자주시켜먹을게요
0,서울특별시,중구,분식,이명근떡볶이,2021,3,5,5,5,5,리뷰가 조금 늦었습니다! 너무 맛있게 잘먹었습니다 사장님도 엄청 친절하십니다! 화이팅하셔요 :)
0,서울특별시,중구,분식,이명근떡볶이,2021,3,5,5,5,5,언제먹어도 맛있습니다~
0,서울특별시,중구,분식,이명근떡볶이,2021,3,5,5,5,5,너무 달지 않고 맛있었어요!
0,서울특별시,중구,분식,이명근떡볶이,2021,3,5,5,5,5,늘 맛있게 먹어요! 먹다가 정신없어서 사진도 깜빡하구 중긴에 찍었네요
0,서울특별시,중구,분식,이명근떡볶이,2021,3,5,5,5,5,"자가격리중 혼자 먹기에 양 엄청 넉넉하고 맛있었어요! 튀김도 진짜 맛있고.. 아 매운맛이라 쪼끔 맵긴했지만 맛있는 매콤함이었고요. 라면사리도 기본이라 넘 좋았고, 저는 혼자 먹어서 거의 이틀 내내 이거로 밥 먹은거 같아요ㅋㅋ 번창하세요!"
0,서울특별시,중구,분식,이명근떡볶이,2021,3,5,5,5,5,이명근 사장님. 이렇게 맛있는 떡볶이를 만들어주셔서 감사합니다. 국물이 진짜 예술의 경지에 이르른 것 같습니다. 오늘도 거하게 한 잔 하고 갑니다. 건배!
0,서울특별시,중구,분식,이명근떡볶이,2021,3,5,5,5,5,꿀맛! 아주 맛있게 잘먹었습니다
0,서울특별시,중구,분식,고릴라김밥,2021,3,4,4,4,3,중구필동 1가스타빌딩1004호입니다 순대가 배달이 안 왔어요 어떻해 된건지 궁금하네요 순대값 환불 해주세요
0,서울특별시,중구,분식,고릴라김밥,2020,9,1,1,1,1,주문한지 1시간 50분만에 예정도착시간보다 훨씬 늦게 도착함 가게 3번해도 전화도 안받음 불고기 도시락은 메뉴사진과 많이 다르고 상추에서 흙이 입에서 버석거리는듯해서 상추 뒤집으니 제대로 안씻겨져서 왔음 밥이랑 반찬은 한두숫락양이고 최악입니다 다시는 주문안할께요
0,서울특별시,중구,분식,고릴라김밥,2020,9,4,4,4,4,양도 많고 맛도 좋았습니다. 배달하시는 분도 친절하시구요!! 감사합니다
0,서울특별시,중구,분식,고릴라김밥,2020,8,1,1,1,1,아..진짜 최악이에요 주문하고 배달 예상 시간이 너무 오래 걸려서 2분 만에 주문 취소 요청 했는데 이미 돈까스 조리가 들어갔다며 취소 안된다고 안내하고 배달 예정 시간에 제대로 오지도 않고.. 직장인인데 아예 점심을 못먹었네요.. 취소만 ㅈ제대로 해줬어도 다른데서 시켰을텐데 시간 좀 지나니 아예 전화도 안받고 오피스가에서 바쁜시간 이해하는데 그래도 너무 불친절해요
0,서울특별시,중구,분식,고릴라김밥,2020,8,4,3,5,4,다 뭐 보통여습니다
0,서울특별시,중구,분식,고릴라김밥,2020,8,5,5,5,5,맛있고 양도 많아요. ㅎㅎ
0,서울특별시,중구,분식,고릴라김밥,2020,8,5,4,5,5,사진은 몬 찍었습니다. 배달서비스 정말 👍  양은 정말 많아요
0,서울특별시,중구,분식,고릴라김밥,2020,7,3,3,4,3,"솔직히 김밥, 어묵은 정말 맛있었는데... 떡볶이, 튀김, 순대 너무 맛없었습니다. 거의 다 남겼네요..."
0,서울특별시,중구,분식,고릴라김밥,2020,6,4,4,4,5,맛은 별4개드리고싶습니다 순대만 팔지 않는지 의문입니다 간싫어한다고 보내지말아달라고 했는데 순대판매만 불가하면 순대옆에 순대만 판매불가하다거나 전화나 배달하시는분께 순대만은 불긴하다라고 안내해주셨으면 좋겠습니다
0,서울특별시,중구,분식,고릴라김밥,2020,6,5,5,5,5,김밥이 맛나고 양도 넉넉합니다 배송도 빨랐어요
0,서울특별시,중구,분식,고릴라김밥,2020,6,5,4,5,5,맛있음! 근데 후루룩떡볶이 너무 묽어서 싱겁고 맛없었음.... 베이컨김볶밥은 개존맛
0,서울특별시,중구,분식,고릴라김밥,2020,5,4,4,4,5,김밥이 다붙어있어서 먹기 힘들었던거빼고는 평범한 맛임
0,서울특별시,중구,분식,고릴라김밥,2020,5,5,5,4,5,양도 많고 맛있네요 배달도 빨랐어요
0,서울특별시,중구,분식,고릴라김밥,2020,5,3,4,4,4,순대 내장 빼달라고 했는데 보내주셨네요ㅜ
0,서울특별시,중구,분식,고릴라김밥,2020,4,5,5,5,5,맛있어서 종종 주문해서 먹습니다~ 부족한 점심시간에 빠르게 배달되서 좋았습니다^^
0,서울특별시,중구,분식,고릴라김밥,2020,4,4,4,5,4,김밥은 맛 나내요. 김이 좀 말라서 기름을 살짝 발랐으면 좋았을텐데라는... 쫄면은 시간차상 어쩔수 없구요.
0,서울특별시,중구,분식,고릴라김밥,2020,4,4,5,4,2,배달시간이 너무걸립니다. 110분소요
0,서울특별시,중구,분식,고릴라김밥,2020,3,1,1,4,3,김밥이 칼질도 안되있고 다 터져서 왔음. 개밥처럼 주워서 먹어야함. 유부는 너무말라서 물에 끓여먹어야 할듯. 김밥에 기름칠도 전혀없음. 목메이는 김밥. 지금까지 먹어본 김밥중 가장 최악임.
0,서울특별시,중구,분식,고릴라김밥,2020,3,5,5,5,5,따뜻하고 불맛나는 김밥~~ 직원분들과 맛나게 먹었구요~ 고추장불고기 김밥 맛나네여~ 또 신청할께요~
0,서울특별시,중구,분식,고릴라김밥,2020,3,2,3,4,4,그 오텡탕의 국물대부분 다 빠져서 근처의 김밥다 젖었어요.
0,서울특별시,중구,분식,고릴라김밥,2020,3,5,5,5,5,맛좋습니다배달좋습니다
0,서울특별시,중구,분식,고릴라김밥,2020,3,5,5,5,5,배달도빠르고맛있네요 불갈비김밥은 매운게아니고 불맛나는 갈비김밥입니다
0,서울특별시,중구,분식,고릴라김밥,2020,3,5,5,5,5,맛있고 배달도 신속해서 좋았습니다
0,서울특별시,중구,분식,고릴라김밥,2020,3,5,5,5,5,배달1시간걸린데서 걱정했는데 30분만에 와주셔서 빨리먹었어요. 순대도말랑하고 맛있게잘먹었습니다
0,서울특별시,중구,분식,동래복국-본점,2021,4,5,5,5,5,몸보신하는 기분으로 먹습니다 탕속의 살이 전보다 퍽퍽해진것같지만 그래도 맛나게 먹었네요 세트로 시키고 리뷰이벤트하니 무침에 튀김에 한끼가 너무 든든합니다
0,서울특별시,중구,분식,동래복국-본점,2021,3,5,5,5,5,식당에서도 몇번 먹어봐서 맛있는줄은 알았어요 :) 리뷰이벤트해서 튀김까지 맛있게 잘 먹었습니다.
0,서울특별시,중구,분식,엄마손돼지불백-대학로점,2021,7,3,4,4,4,맛있어서 재주문했어요 다만 사장님께 따로 말하고 싶은 ㅠㅠ 뚜껑열자마자 찍어서 이 절임은 못먹었어요 위생에도 신경써주세요
0,서울특별시,중구,분식,엄마손돼지불백-대학로점,2021,7,5,5,5,5,정신없이 먹다가 잠깐 정신차리구 사진찍어 올려요 리뷰는 잘 안쓰는데 울딸이 넘 맛있다구 한그릇 뚝딱하길래 기쁜맘으로 올려요 반찬들도 맛있고 고등어도 진짜 맛있네요 자주시켜먹을께요 번창 하세요
0,서울특별시,중구,분식,엄마손돼지불백-대학로점,2021,7,5,5,5,5,집밥맛이예요 아이랑 어른둘 2인분으로 맛있게 먹었습니다
0,서울특별시,중구,분식,엄마손돼지불백-대학로점,2021,7,1,2,1,2,양배추 샐러드 맛이이상해요 상하기 일보직전
0,서울특별시,중구,분식,엄마손돼지불백-대학로점,2021,7,5,5,5,5,첨시켯는데 깔끔하고 맛있었습니다 다만 냉면에 겨자식초가빠졌어요~
0,서울특별시,중구,분식,엄마손돼지불백-대학로점,2021,7,5,5,5,5,앞으로생선구이는 여깁니다
0,서울특별시,중구,분식,엄마손돼지불백-대학로점,2021,7,5,5,5,5,얼마전에 시켜먹고 또 시켜먹기 ~~ 궁금해서 찾아봤는데 7번째 주문이더라고요 고등어는 처음인데 양이 아주 많아요!! 그리고 늘 너무맛있는 다양한 밑반찬 ㅠㅠ (리뷰 두개 한꺼번에 쓰고 있는데 저번고기랑 이번 고등어 랩핑이 제대로 안되어서 왔었어요 ㅠㅠ )
0,서울특별시,중구,분식,엄마손돼지불백-대학로점,2021,7,5,5,5,5,항상 맛있게 잘먹고 있어오 ~~~ 늘 요청 사항도 잘 들어주시고 배달도 빠릅니다!!
0,서울특별시,중구,분식,엄마손돼지불백-대학로점,2021,7,5,5,5,5,맛있게 잘먹었습니다~
0,서울특별시,중구,분식,엄마손돼지불백-대학로점,2021,6,5,5,5,5,양도 괜찮고 맛있었어요 비빔은 좀 매운 것 같아요
0,서울특별시,중구,분식,엄마손돼지불백-대학로점,2021,6,5,5,5,5,잘먹었슴다 ㅋ ㅎㅋ
0,서울특별시,중구,분식,엄마손돼지불백-대학로점,2021,6,5,5,5,5,고등어가 안비리고 맛나요 반찬도 다양해요
0,서울특별시,중구,분식,엄마손돼지불백-대학로점,2021,6,5,5,5,5,맛있게 잘먹었습니다 갈치가 통통해요
0,서울특별시,중구,분식,엄마손돼지불백-대학로점,2021,6,5,5,5,4,맛있어요 고등어가 하나도 안비리고 너무 맛있네요
0,서울특별시,중구,분식,엄마손돼지불백-대학로점,2021,5,5,5,5,5,잘 구어진 생선구이와 간이 잘 배어있는 돼지불백까지 너무 맛있게 잘 먹었습니다. 한식 한상 잘 차려 먹은 기분이었어요 ㅎㅎ 그리고 청국장도 구수하고 좋았네요
0,서울특별시,중구,분식,엄마손돼지불백-대학로점,2021,5,5,5,5,5,항상 맛있어요! 자주 시켜먹다가 오랜만에 시켰네용
0,서울특별시,중구,분식,엄마손돼지불백-대학로점,2021,5,5,5,5,5,맛있게 먹었어요~아이들도 잘 먹어요~
0,서울특별시,중구,분식,엄마손돼지불백-대학로점,2021,5,5,5,5,5,맛있구 양 많아서죠아요. 사장님 수고하세요
0,서울특별시,중구,분식,엄마손돼지불백-대학로점,2021,5,5,5,5,5,"점심시간 정해져 있는 치과라서 배달시간이 중요한데, 시간도 맛도 다 만점입니다! 다음에 또 시켜먹을게요. 감사합니다😊"
0,서울특별시,중구,분식,엄마손돼지불백-대학로점,2021,5,5,5,5,5,맛있구 또먹구싶어요 다음에 또시킬깨요
0,서울특별시,중구,분식,엄마손돼지불백-대학로점,2021,4,5,5,5,5,전에 한창 자주 시켜먹다가 오랜만에 생각나서 시켜먹었어요! 반찬이 다양하고 맛있어서 너무 좋고 전에는 계란후라이가 없었는데 서비스로 주신건가요 ?? 잘 먹었습니다!!
0,서울특별시,중구,분식,엄마손돼지불백-대학로점,2021,4,5,5,5,5,빠르고 너무 맛있어요♡♡♡
0,서울특별시,중구,분식,엄마손돼지불백-대학로점,2021,4,5,5,5,5,너무 맛있네요 감사합니당
0,서울특별시,중구,분식,엄마손돼지불백-대학로점,2021,4,5,5,5,5,너무 너무 맛있어요
0,서울특별시,중구,분식,엄마손돼지불백-대학로점,2021,4,5,5,5,5,맛있게 잘 목었습니다
0,서울특별시,중구,분식,엄마손돼지불백-대학로점,2021,4,5,5,5,5,정말 맛있게 잘 먹었습니다
0,서울특별시,중구,분식,엄마손돼지불백-대학로점,2021,4,5,5,5,5,잘 먹었습니다 ㅌㅇ
0,서울특별시,중구,분식,엄마손돼지불백-대학로점,2021,3,5,5,5,5,청국장한숟갈뜨는데 몸과맘이 녹네요😅💕 생선구이도 생선구이라고 화덕이니 머니 요새 상호단곳들보다 나아요 리뷰가좋아서 시켰는데 리뷰써주신분들 감사합니다 백반집은 이제 이집으로 정착🤤👍
0,서울특별시,중구,분식,엄마손돼지불백-대학로점,2021,3,5,5,5,5,급하게 먹느라 사진 못찍었어요~ 매장에서나 집에서나 바쁠때 시켜서 너무 맛있게 먹고 있어요~ 반찬도 자주 바뀌고 구성도 좋고 국도 너무 맛있어요!! 돼지불백 최고로 맛있고 고등어구이도 가성비 좋고 맛있더라구요^^
0,서울특별시,중구,분식,엄마손돼지불백-대학로점,2021,3,5,5,5,5,잘먹었어요 맛있어요
0,서울특별시,중구,분식,엄마손돼지불백-대학로점,2021,3,5,5,5,5,너무맛있어요!! 다음에 또시킬게요 ㅎㅎ
0,서울특별시,중구,분식,엄마손돼지불백-대학로점,2021,3,5,5,5,5,생선이 먹고 싶다면 요기에서 주문합니다
0,서울특별시,중구,분식,엄마손돼지불백-대학로점,2021,3,5,5,5,5,맛있어요 추천합니다 여러번 주문합니다
0,서울특별시,중구,분식,엄마손돼지불백-대학로점,2021,3,5,5,5,5,자주 시켜먹는곳 맛을 배신하지않고 잘먹었어요
0,서울특별시,중구,분식,삼첩분식-혜화점,2021,7,5,5,5,4,배달이 예상 시간에 딱맞춰왔어요! 맛있어요 개인적으로 매운걸 잘 못먹어서 살짝 맵긴한데 덜맵게 하면 별로일까봐 1단계로 했어요 리뷰 이벤트로 당면만두도 주셨어요!
0,서울특별시,중구,분식,삼첩분식-혜화점,2021,7,5,5,5,,환경생각한 종이가방도 좋고 소스랑 단무지도 주셔서 좋고 양도 많고 사장님도 친절하세요! 감사히 잘먹겠습미다! 떡볶이는 조금 먹은 양입니다
0,서울특별시,중구,분식,삼첩분식-혜화점,2021,7,5,5,4,5,순한거 좋아하는 저에겐 1단계 매운맛 딱 좋아용 신라면 보다 살-짝 덜 매운 맵기? 소스도 제가 먹어본 로제들 중 젤 느끼하지 않는거같아요!! 넘 맛있네요 궁금해서 시켜봤는데 대만족 ㅎㅎ 감자도 찰떡🤤
0,서울특별시,중구,분식,삼첩분식-혜화점,2021,6,5,5,5,5,잘 먹었습니다~ 로제시킨다는것이 일반을 시켰네요 ㅜ
0,서울특별시,중구,분식,삼첩분식-혜화점,2021,6,5,5,5,5,마라 맛있어요 색다른 맛
0,서울특별시,중구,분식,삼첩분식-혜화점,2021,6,5,5,5,5,양도 푸짐하고 너무 맛있네요~~
0,서울특별시,중구,분식,삼첩분식-혜화점,2021,6,5,5,5,5,너무 맛있게 잘 먹었습니다~~ 포장보구 놀랐어요 ㅋㅋㅋㅋㅋㅋ
0,서울특별시,중구,분식,삼첩분식-혜화점,2021,6,5,5,5,5,양도 많고 정말 맛있었습니다!
0,서울특별시,중구,분식,삼첩분식-혜화점,2021,6,5,5,5,5,맛있어요 2단계 딱 적당한 매운맛입니다
0,서울특별시,중구,분식,삼첩분식-혜화점,2021,6,5,5,5,5,맛있고 양도 푸짐하고 좋아요~~
0,서울특별시,중구,분식,삼첩분식-혜화점,2021,6,5,5,5,5,잘먹었어요 ~~ 짱맛남 적당히 매운거 좋아하면 2단계강추
0,서울특별시,중구,분식,삼첩분식-혜화점,2021,6,5,5,5,,매움단계를올려야맛있습니다
0,서울특별시,중구,분식,삼첩분식-혜화점,2021,6,5,5,5,,맛있어요 완전!!! 로제떡볶이 진짜 최고네요ㅠㅠㅠ 담에 또 먹을래용 헤헤
0,서울특별시,중구,분식,삼첩분식-혜화점,2021,6,5,5,5,,매번 만족합니다 재주문의사 100%
0,서울특별시,중구,분식,삼첩분식-혜화점,2021,6,5,5,5,5,맛있게 잘먹었습니당~!
0,서울특별시,중구,분식,삼첩분식-혜화점,2021,6,5,5,5,5,대박 맛있어요 너무 느끼하지도 맵지도 않은 적당한 로제입니다 대패볶음밥도 맛있네요 ㅎㅎ
0,서울특별시,중구,분식,삼첩분식-혜화점,2021,6,5,5,5,5,삼첩분식 진짜 맛있어요 마라로제 또 시켜 먹을 듯
0,서울특별시,중구,분식,삼첩분식-혜화점,2021,6,5,5,5,,오랜만에 별 5개 주는 매장인거 같다 사장님도 친절하시고 맛과 가격이 다 착한 가게라 자주 이용할듯 싶다
0,서울특별시,중구,분식,삼첩분식-혜화점,2021,5,5,5,5,5,너무맛있어요! 푸짐하고요.
0,서울특별시,중구,분식,삼첩분식-혜화점,2021,5,5,5,5,5,배달빠르고 맛있습니다
0,서울특별시,중구,분식,삼첩분식-혜화점,2021,5,5,5,5,,삼첩분식 맛있다구 아들친구 엄마가 엄청 얘기했는데.. 로제 떡볶기 요즘 많아서...큰기대 안했는데... 먹어본 로제떡볶기중 최고네요!! 로제 잘못먹음 느끼한 집 많은데.. 깔끔한 로제 맛이라 해야하나~~ 튀김들도 기름 냄새 안나구 딱 좋네요!! 집앞이라 포장 방문 했는데 아들 보더니 사이다 써비스로 주셨어욤^^ 감사합니다!!친절한사장님~~~
0,서울특별시,중구,분식,삼첩분식-혜화점,2021,5,5,5,5,5,로제떡볶이는 역시 삼첩... 감자튀김이랑 소스도 너무 맛있어요. 중당까지 추가해서 그런지 양도 엄청 많고 맛있습니당!!
0,서울특별시,중구,분식,삼첩분식-혜화점,2021,5,5,5,5,5,맛있게 잘 먹었습니다~많이 시킨건지 양이 많은건지 어른3명에 아이 1명 먹는데도 너무 배부르게 먹었어요^^
0,서울특별시,중구,분식,삼첩분식-혜화점,2021,5,5,5,5,5,맛ㅆ어요!!!!!!!
0,서울특별시,중구,분식,삼첩분식-혜화점,2021,5,5,5,5,5,따끈따끈하고 맛있게 먹었습니다ㅎㅎ
0,서울특별시,중구,분식,삼첩분식-혜화점,2021,5,5,5,5,5,양 많고 맛있어요 잘 먹었습니다
0,서울특별시,중구,분식,삼첩분식-혜화점,2021,5,5,5,5,5,배달이 빨리 와서 좋았습니다
0,서울특별시,중구,분식,삼첩분식-혜화점,2021,5,5,5,5,5,포장도 깔끔하고 맛있네요
0,서울특별시,중구,분식,삼첩분식-혜화점,2021,5,5,5,5,5,맛있네요. 다만 치킨이 좀 까만게 오래된 기름을 썼나 의심들었지만 맛있어서 착각이라 생각합니다.
0,서울특별시,중구,분식,삼첩분식-혜화점,2021,5,5,5,5,,예전에 처음 먹었을때는 그냥 그랬는데 로제 여러 브랜드 먹어보고 다시 먹으니까 진짜 맛있네요! 매운맛으로 하니까 더 맛있어용
0,서울특별시,중구,분식,삼첩분식-혜화점,2021,5,5,5,5,5,배달 진심 빨라요 여전히 양 많고 맛있어요 추천
0,서울특별시,중구,분식,삼첩분식-혜화점,2021,5,5,5,5,5,치즈폭탄 이름값하네요 넘 좋아여 담엔 더 매운맛 먹어야겠어여
0,서울특별시,중구,분식,삼첩분식-혜화점,2021,5,5,5,5,5,떡볶이 영롱한것좀 보세요 여러분!!!! 로제 처음먹어봤는데 처음만나보는존맛탱 저는 파스타도 로제만먹는데 왜 이 맛있는걸 이제서야 먹었는지 모르겠네요. 밀떡파인데 적당히 얇은 밀떡 쫠깃쫠깃 존재감오지구여 밀떡쫠깃에 뒤지지않는 쫠깃한 오뎅 그리고 소스 적당히 배인 메추리알 다들 극찬해서 먹어봤는데 예상보다 더 맛있었던 치즈까지 이건 예술입니다 저는 순대처돌이인데 순대좋아하면 여기순대드세요 분명순대맛인데 완벽하게찰져서 떡인줄알았어요 튀김 황금빛에 바삭바삭하고 오징어 통살 꽉차있어서 미친존맛탱인건 글자수부족하니까 그만말할게요 ㅃㅃ
0,서울특별시,중구,분식,삼첩분식-혜화점,2021,5,5,5,5,5,로제떡볶이에 빠져서 로제만 먹습니다ㅠㅠ 너무 맛있어요!!
0,서울특별시,중구,분식,삼첩분식-혜화점,2021,5,5,5,5,5,맛있어요~~치즈폭탄 감사합니다
0,서울특별시,중구,분식,삼첩분식-혜화점,2021,5,5,5,5,5,양도 많고 맛있습니다~~!! 로제 최고
0,서울특별시,중구,분식,삼첩분식-혜화점,2021,5,5,5,5,5,양이 정말 많아서 푸짐하게 잘 먹었어요.
0,서울특별시,중구,분식,삼첩분식-혜화점,2021,5,5,5,5,5,허겁ㅈ걱먹는다고 사진을못찍었네요  ㅈ너무잘먹었어요 최고
0,서울특별시,중구,분식,삼첩분식-혜화점,2021,5,5,5,5,5,양도 많고 맛있어요!
0,서울특별시,중구,분식,삼첩분식-혜화점,2021,5,5,5,5,5,맛있게 잘 먹었습니다
0,서울특별시,중구,분식,삼첩분식-혜화점,2021,5,5,5,4,5,넘 맛있게 잘 먹었습니다
0,서울특별시,중구,분식,삼첩분식-혜화점,2021,5,5,5,5,5,"맛있고 포장, 양 모두 합격입니다 👍 즐거운 한끼 감사합니다!"
0,서울특별시,중구,분식,삼첩분식-혜화점,2021,5,5,5,5,5,믿고 먹는 삼첩분식
0,서울특별시,중구,분식,삼첩분식-혜화점,2021,5,5,5,5,5,맛나게 잘 먹었습니다~ 양도 많고 맛있었어요
0,서울특별시,중구,분식,삼첩분식-혜화점,2021,5,5,5,5,5,맛있네요! 감자가 특히 굿
0,서울특별시,중구,분식,삼첩분식-혜화점,2021,5,5,5,5,5,처음 먹어봤는데 맛있게 잘 먹었습니다!!!!
0,서울특별시,중구,분식,삼첩분식-혜화점,2021,5,5,5,5,5,양 정말 많아요 감자튀김이 별미네요
0,서울특별시,중구,분식,삼첩분식-혜화점,2021,5,5,5,5,5,로제 대존맛이에요!!! 양 적당하고 맛있어요 ㅎㅎㅎ
0,서울특별시,중구,분식,삼첩분식-혜화점,2021,5,5,5,5,5,처음 시켰는데 넘 맛있고 담에 또 시킬게요.
0,서울특별시,중구,분식,삼첩분식-혜화점,2021,5,5,5,5,5,양 많고 맛있어요 다음에도 주문할게요
0,서울특별시,중구,분식,삼첩분식-혜화점,2021,5,5,5,5,5,이틀 연속으로 시켜먹었어요~ 로제 강추입니다!
0,서울특별시,중구,분식,삼첩분식-혜화점,2021,5,5,5,5,5,포장도 깔끔하고 맛도 너무 좋습니다!
0,서울특별시,중구,분식,삼첩분식-혜화점,2021,5,5,5,4,5,포장 깔끔하고 배달도 빨리오고 맛도 좋고 ㅎㅎ 다음번에는 매운거 먹어보고 싶네요
0,서울특별시,중구,분식,삼첩분식-혜화점,2021,5,5,5,5,5,요즘 로제떡볶이가 인기라 여기저기 먹어보고 있는데 삼첩분식 로제는 국물이 많아서 또 다른 맛이네요. 맛있습니다!!
0,서울특별시,중구,분식,삼첩분식-혜화점,2021,5,5,4,4,5,튀김양은 괜찮은데 떡볶이양이 조금 부족한 느낌입니다
0,서울특별시,중구,분식,삼첩분식-혜화점,2021,5,5,5,5,5,로제떡볶이 넘 맛있어요! 약간 크림스프? 맛도 나고 단짠단짠 입니다~ 대패볶음밥 전부터 궁금했는데 입가심으로 좋네요 로제떡볶이랑 잘 어울려요. 리뷰이벤트로 치즈도 무지 많이 넣어주셔서 감사합니다❤
0,서울특별시,중구,분식,삼첩분식-혜화점,2021,5,5,5,5,5,맛있고 양도 많고 진짜 최고.. 떡볶이집 주문 1순위 여기로 바꿉니다 오늘부터
0,서울특별시,중구,분식,삼첩분식-혜화점,2021,5,5,5,5,5,로제떡볶이 처음 먹어보는데 너무 맛있어요! 감자튀김도 바삭하고 맛있었어요 👍👍
