,시,구,업종명,가게명,년,월,전체평점,맛 평점,양 평점,배달 평점,리뷰 내용
0,서울특별시,중구,분식,두마리치킨치킨나라-본점,2021,7,5,5,5,5,배달도 빠르고 맛도 맛이지만 양이 장난 아님 떡볶이는 정말 존맛탱입니다 치킨은 정말 부드럽고 깨끗한 기름에 튀긴것 같아요 번창하시길~~
0,서울특별시,중구,분식,두마리치킨치킨나라-본점,2021,7,5,5,5,5,맛있게 잘 먹었습니다
0,서울특별시,중구,분식,두마리치킨치킨나라-본점,2021,7,5,5,5,5,맛있게 잘먹었습니당~
0,서울특별시,중구,분식,두마리치킨치킨나라-본점,2021,7,5,5,5,5,후라이드 예술이네요 푸짐하고 맛있게 먹었습니다
0,서울특별시,중구,분식,두마리치킨치킨나라-본점,2021,7,5,5,5,5,맛있고 양도 많고 배달도 빨라요~
0,서울특별시,중구,분식,두마리치킨치킨나라-본점,2021,7,5,5,5,5,양도많고 치킨도 바삭하니 맛있게 먹었어요 앞으로 치킨집은 여기서만!!!
0,서울특별시,중구,분식,두마리치킨치킨나라-본점,2021,7,5,5,5,5,맛집 발견입니다!! 양도 많고 맛있게 잘 먹었어요. 다음에 또 주문할께요~
0,서울특별시,중구,분식,두마리치킨치킨나라-본점,2021,7,1,3,5,5,치즈떡볶이가먹고싶음그걸시켜먹었겠지요.맛나게먹으라고생각해서올려주신건 감사하나.. 제가 치즈를못먹는데 두드러기가나는데 어찌먹나요.. 다시가져다줄수없냐하니 배달비안나와안된다하고 걷어내고먹으라는데치즈가녹아스며들어 걷어내지도못하고 환불도 안해주시고 떢볶이는 감사히 버립니다.. 치킨은 잘먹고있네요.이유야 어찌됐든 이건 가게 실수입니다.한명의고객쯤이야 떨어져나가도상관없다는 식의 이렇게 장사하시면안돕니다.
0,서울특별시,중구,분식,두마리치킨치킨나라-본점,2021,7,5,5,5,5,잘 먹었습니다 ~~~ 양이 진짜 많네요 ㄷㄷ 또 주문 할게요 !
0,서울특별시,중구,분식,두마리치킨치킨나라-본점,2021,7,5,5,5,5,떡볶이가 생각보다매워서 당황했지만 맛있게먹었습니다
0,서울특별시,중구,분식,두마리치킨치킨나라-본점,2021,6,5,5,5,,잘먹었습니다. 담에또시킬게요
0,서울특별시,중구,분식,두마리치킨치킨나라-본점,2021,6,5,5,5,5,맛 배달 모두 만족이용 ㅋ
0,서울특별시,중구,분식,두마리치킨치킨나라-본점,2021,6,5,5,5,4,오자마자 허겁지겁 먹다보니 사지을 깜박했어여 맛있어서 순삭
0,서울특별시,중구,분식,두마리치킨치킨나라-본점,2021,6,5,5,5,5,배달도 빠르고 맛있네요
0,서울특별시,중구,분식,두마리치킨치킨나라-본점,2021,5,5,5,5,5,너무 맛잇어요~~^^
0,서울특별시,중구,분식,두마리치킨치킨나라-본점,2021,5,5,5,5,5,배달도 진짜 빨리오고 양도 푸짐하고 무엇보다 너무 맛있었습니다!
0,서울특별시,중구,분식,두마리치킨치킨나라-본점,2021,5,5,5,5,5,very very good!
0,서울특별시,중구,분식,두마리치킨치킨나라-본점,2021,5,5,5,5,5,항상 맛있는데 튀김이 쫌 많았어요
0,서울특별시,중구,분식,두마리치킨치킨나라-본점,2021,5,2,4,4,4,치킨색 상이 커무잡잡해었어요
0,서울특별시,중구,분식,두마리치킨치킨나라-본점,2021,5,5,5,5,5,간장치킨이 정말 제취향이였어요 오랜만에 먹으니 맛있네요~~
0,서울특별시,중구,분식,두마리치킨치킨나라-본점,2021,5,5,5,5,5,항상 맛있게 먹고있어요!! 싸장님이 소스 2개나 주셔서 맛있게 먹었숩니당!! 매운간장 진짜 맛있는거 같아요
0,서울특별시,중구,분식,두마리치킨치킨나라-본점,2021,5,5,5,5,5,치킨이 정말 맛있는집!!!!! 강추합니다 ㅎㅎㅎ 애들도 잘먹어요
0,서울특별시,중구,분식,두마리치킨치킨나라-본점,2021,5,5,5,5,5,1마리 양 이렇게 많을줄 몰랐어요 맛있고 서비스도 2개나 주셔서 감사합니다
0,서울특별시,중구,분식,두마리치킨치킨나라-본점,2021,5,5,5,5,5,👍👍👍👍👍👍👍👍👍👍👍👍
0,서울특별시,중구,분식,두마리치킨치킨나라-본점,2021,5,4,4,5,5,맛있고 가성비 좋아요~~!!!
0,서울특별시,중구,분식,두마리치킨치킨나라-본점,2021,5,5,5,5,5,맛있어요 바삭해요!
0,서울특별시,중구,분식,두마리치킨치킨나라-본점,2021,5,4,4,5,4,...........
0,서울특별시,중구,분식,두마리치킨치킨나라-본점,2021,5,5,5,5,5,오랜만에 시켜먹었는데 맛나네요 여전히
0,서울특별시,중구,분식,두마리치킨치킨나라-본점,2021,5,5,5,5,5,굿굿~~.
0,서울특별시,중구,분식,두마리치킨치킨나라-본점,2021,5,5,5,5,5,여기 집 치킨 미쳤습니다 감자튀김서비스 주신것도 양이 많아서 너무 감사하고 치킨도 양 짱많아요 시키면 후회없이 드실 수 잇어요 강추입니다!! 특제소스인지 모르겠는데 치킨에 뿌려먹으면 레전드 잘 먹었습니다 사장님!! 치킨은 여기서만 ㅅㅣ킬게요
0,서울특별시,중구,분식,두마리치킨치킨나라-본점,2021,5,5,5,5,5,하...존맛.... 기사님도 엄청 친절하시고 목소리도 좋앗어요:) 맛 존맛 진짜 맛잇네요
0,서울특별시,중구,분식,두마리치킨치킨나라-본점,2021,5,5,5,5,5,"저희 가족이 마늘치킨 먹고 눈이 땡그래졌어요ㅋㅋㅋ 저랑 동생이 어렸을적 먹었던 마늘치킨이 생각나는 맛.. 그리운 맛... 마늘치킨에 마늘이 있어서 너무 좋았어요! 그리고, 매운양념 치킨 저는 괜찮았는데 저희 가족한테는 너무 매운맛이였나봐요ㅋㅋ그래도 맛있었습니당. 떡볶이도 맛있고, 감튀도 맛있고♪♬ 가족들이 만족해 하며 먹었습니당"
0,서울특별시,중구,분식,두마리치킨치킨나라-본점,2021,5,5,5,5,5,배달도 그렇게 늦지않았고 서비스로 주신 감튀가 진짜 맛있었어요! 떡볶이랑 치킨도 맛있게 먹었어요~~~
0,서울특별시,중구,분식,두마리치킨치킨나라-본점,2021,4,5,5,5,4,사진은 없지만 맛있게 잘먹었습니다!
0,서울특별시,중구,분식,두마리치킨치킨나라-본점,2021,4,5,5,5,5,양이 많아요 떡볶이가 칼칼해서 치킨이랑 궁합이 잘 맞아요^^ 서비스 감자튀김 감사합니당
0,서울특별시,중구,분식,두마리치킨치킨나라-본점,2021,4,5,5,5,5,두명이서 완전 배부르게먹었어요 치킨도 맛있었는데 떡볶이도 싸게 잘먹었습니다 다음에 또 시켜먹을게요!
0,서울특별시,중구,분식,두마리치킨치킨나라-본점,2021,4,5,5,5,4,치킨 떡볶이 감튀 전부다맛있게 먹었어요ㅎㅎ 감튀 서비스 감사합니당
0,서울특별시,중구,분식,두마리치킨치킨나라-본점,2021,4,5,5,5,5,매운양녕은 처음 먹어봤는데 맛있었어요!! 같이온 간장 소스도 마늘치킨에 잘어울리구용 맛있게 잘 먹었습니다!!!
0,서울특별시,중구,분식,두마리치킨치킨나라-본점,2021,4,4,5,5,5,맛도좋고 배달도빠르고 좋았어요
0,서울특별시,중구,분식,두마리치킨치킨나라-본점,2021,4,5,5,5,5,최고입니다. 한주 마무리가 아주좋았어요
0,서울특별시,중구,분식,두마리치킨치킨나라-본점,2021,4,5,5,5,5,맛있어요! 서비스로 감자튀김도 주시고 잘 먹었습니다
0,서울특별시,중구,분식,두마리치킨치킨나라-본점,2021,4,5,5,5,5,맛있어요
0,서울특별시,중구,분식,두마리치킨치킨나라-본점,2021,4,5,5,5,5,네가지맛 굿 한가지나 두가지시키면 물리는데 후라이드도 매콤하니맛나구 다맛있어요 양도 푸짐 배달시간도  정확해요
0,서울특별시,중구,분식,두마리치킨치킨나라-본점,2021,4,5,5,5,5,맛있게 잘 먹었습니다!
0,서울특별시,중구,분식,두마리치킨치킨나라-본점,2021,4,5,5,5,5,가격 보고 이가격이 되나 했는데 가격 이상의 맛을 보여주네요 비싼 치킨의 그맛은 아니지만 가성비 극강입니다
0,서울특별시,중구,분식,두마리치킨치킨나라-본점,2021,4,5,5,5,5,맛있습니다 다시한번시킬게요
0,서울특별시,중구,분식,두마리치킨치킨나라-본점,2021,4,5,5,5,5,친구랑 밤늦게 야식으로 시켜먹었어요 떡볶이가 진짜맛있어요ㅋㅋㅋ가성비 최고네용 감자도 너무 맛있었어요
0,서울특별시,중구,분식,두마리치킨치킨나라-본점,2021,4,5,5,5,4,후라이드 바삭~ 하고^^ 양념치킨도 맛있네요 떡볶이 가성비 짱입니다.~~ 잘 먹었어요~ 배달이 시간보다 좀 늦어서 살짝 아쉬웠지만 맛있게 먹었으니 됐죠~ ㅎ
0,서울특별시,중구,분식,두마리치킨치킨나라-본점,2021,4,5,5,5,5,맛나게 잘먹었습니다~
0,서울특별시,중구,분식,두마리치킨치킨나라-본점,2021,4,5,5,5,5,맛있게 잘먹었습니다
0,서울특별시,중구,분식,두마리치킨치킨나라-본점,2021,4,5,5,5,,요기요 쿠폰이 있길래 주문해봤는데 쿠폰 쓴게 죄송해질정도로 너무 너무 맛있네요 서비스 감자튀김도 주시고! 시간도 딱맞게 나와서 기다리지도 않고 바로 받았고 후라이드는 정말로 깔끔한 후라이드의 정석이라고 할수있을만큼 바삭함과 짭쪼름함이 적당히 어우러져있었고 간장은 단짠단짠이 적당히 조화되어서 정말 맛있게먹고있네요 서비스로 주신 감자튀김도 너무 잘먹었구요 참 쉽지않은 월요일이었는데 사장님 덕분에 오늘 하루 기분좋게 마무리합니다 다음에 또 주문할게요 감사합니다 힘내시고 장사 잘되시기만 바라겠습니다
0,서울특별시,중구,분식,두마리치킨치킨나라-본점,2021,4,1,1,1,5,너무 .... 짭니다.. 진짜 반도 못먹겠어요
0,서울특별시,중구,분식,두마리치킨치킨나라-본점,2021,4,5,5,5,5,배달기사님도 친절하시구 배달도 빠르고 가족들이랑 맛있게 잘먹었습니다!
0,서울특별시,중구,분식,두마리치킨치킨나라-본점,2021,3,5,5,5,5,"맛있어요,,,밥이랑 먹어도 괜찮네요"
0,서울특별시,중구,분식,두마리치킨치킨나라-본점,2021,3,5,5,5,5,잘먹었습니닿ㅎㅎㅎㅎ
0,서울특별시,중구,분식,두마리치킨치킨나라-본점,2021,3,5,5,5,5,한달만에 시켰어요~ 조금씩 계속 바뀌는 거 같아요ㅎㅎ 그래도 맛있고 양 많고 배달 빨라요^^
0,서울특별시,중구,분식,두마리치킨치킨나라-본점,2021,3,5,5,5,5,맛있고 배달도 빨라서 아주 맘에들어요
0,서울특별시,중구,분식,두마리치킨치킨나라-본점,2021,3,5,5,5,5,정말 맛있습니다 강추강추!!
0,서울특별시,중구,분식,두마리치킨치킨나라-본점,2021,3,5,5,5,5,맛있네요 잘먹었습니닷
0,서울특별시,중구,분식,두마리치킨치킨나라-본점,2021,3,5,5,5,5,넘맛있어요ㅋㅋㅋㅋ완죤
0,서울특별시,중구,분식,두마리치킨치킨나라-본점,2021,3,1,5,4,1,ㅋㅋㅋ직원이 집앞에서 집 * 있네 이러고 들어왔습니다. 이게 맞나요? 다신안시킬게요
0,서울특별시,중구,분식,두마리치킨치킨나라-본점,2021,3,5,5,5,5,너무 맛있어요 용량도 많구요~
0,서울특별시,중구,분식,두마리치킨치킨나라-본점,2021,3,5,5,5,5,잘먹었습니다.
0,서울특별시,중구,분식,두마리치킨치킨나라-본점,2021,3,5,5,5,5,너무 맛잇게 잘먹엇습니다 브라보 짱!
0,서울특별시,중구,분식,두마리치킨치킨나라-본점,2021,3,5,5,5,5,생각보다 빨리 도착햇습니다!! 리뷰 이벤트로 주신 소스도 잘 받앟어용!!
0,서울특별시,중구,분식,두마리치킨치킨나라-본점,2021,3,5,4,5,5,후라이드 맛있습니다 간장은 많이 짠거 같아요
0,서울특별시,중구,분식,두마리치킨치킨나라-본점,2021,3,5,5,5,5,순살은 처음 시켜봤는데 역시나 맛있네요 잘먹었습니다ㅎㅎㅎ
0,서울특별시,중구,분식,두마리치킨치킨나라-본점,2021,3,5,5,5,5,떡볶이랑 치킨 두개가 생각나서 주문했습니다 양도 적당하고 무난하게 잘 먹었습니다
0,서울특별시,중구,분식,두마리치킨치킨나라-본점,2021,3,5,4,2,5,맛은 맛있는데 양이 상당히 적은 느낌입니다ㅜㅜ
0,서울특별시,중구,분식,두마리치킨치킨나라-본점,2021,3,5,5,5,5,"후라이드, 간장치킨 넘 맛있어요~~ 아이들이 맛있다고 순삭했네요^^"
0,서울특별시,중구,분식,두마리치킨치킨나라-본점,2021,3,5,5,5,5,너~~~~~무 맛있었어요~~~ 감자도주시고 너무 감사해오ㅡ~~~~~
0,서울특별시,중구,분식,두마리치킨치킨나라-본점,2021,3,5,5,5,5,맛좋았습니다. 좀 맛이 짠것 말고는 굿
0,서울특별시,중구,분식,별대봉식당,2021,7,5,5,5,5,여긴 진짜 찐이네요 후기 잘안믿는 편인데 이곳은 정말 맛도있고 양도많고 깔끔하게 포장되서 와요 최고
0,서울특별시,중구,분식,별대봉식당,2021,7,5,5,5,5,넘 맛나용~^~^~^~^^~
0,서울특별시,중구,분식,별대봉식당,2021,7,5,5,5,5,짜글이 맛있어요 도시락도 맛있어요 거기에 양도 많아요
0,서울특별시,중구,분식,별대봉식당,2021,7,5,5,5,5,순살닭도리탕 반찬 도시락 다 맛있어요
0,서울특별시,중구,분식,별대봉식당,2021,7,5,5,5,5,사진이 없어 아쉽네요. 직장동료들과 점심을 푸짐하고 맛나게 ㅁ잘 먹었습니다. 요즘 구내식당이 별로라 배달음식을 찾곤 하는데.... 의외의 단골집이 생긴거 같아요. 낼도 시킬겁니다~^^
0,서울특별시,중구,분식,별대봉식당,2021,7,5,5,5,5,다 먹어가요 사진 찍는거잊고 먹었어요 다먹기전에 찍어요 양 좋고 배달시간 좋고 살짝 매운맛도 좋고 옛날도시락도 좋아요
0,서울특별시,중구,분식,별대봉식당,2021,7,5,5,5,5,진짜맛나요ㅎㅎㅎㅎㅎㅎㅎ 양도많고 최고입니다
0,서울특별시,중구,분식,별대봉식당,2021,7,4,4,3,5,간장찜닭 좋아해서 여러군데 시켜먹어보고 있는 중 발견했어요. 요즘 밥은 따로 주문해야 되는데 옛날도시락이 같이 와서 좋았어요. 맛은 특별하게 튀지않고 무난했어요. 양이 많다고 다른 후기에 있던데 저는 좀 적다고 느껴졌어요.
0,서울특별시,중구,분식,별대봉식당,2021,7,5,5,5,5,완전꿀맛 3명이서먹어두 남음!!!
0,서울특별시,중구,분식,별대봉식당,2021,7,4,4,4,5,네 아주 잘 받아서 잘 먹고 있습니다. 주소를 정확히 알려주지 못해서 배달 하시는 분이 한국어도 서투신데도 고생 많이 하셨습니다.
0,서울특별시,중구,분식,별대봉식당,2021,7,5,5,5,5,맛있어요 항상 시킵니다
0,서울특별시,중구,분식,별대봉식당,2021,7,5,5,5,4,사진은 못찍었지만 양도 많고 맛있게 먹었습니다
0,서울특별시,중구,분식,별대봉식당,2021,7,5,5,5,5,맛있게 잘 먹었습니다.
0,서울특별시,중구,분식,별대봉식당,2021,7,5,5,5,5,코로나때문에 삼실에서 배달음식 주문해서 먹고 있는데 새로운 메뉴 먹어보고 싶어서 찾다가 딱 눈에 띈 고구마찜닭!!! 오홍~~~ 넘넘 맛있어요~~ 단짠단짠 입맛저격!! 다들 먹으면서 맛있다고 감탄사 연발~~ 양도 많고 가성비도 좋고~ 정성담긴 메시지까지ㅋ 맛있게 점심먹었네요~~ 또 주문할게용!!!
0,서울특별시,중구,분식,별대봉식당,2021,7,5,5,5,5,카레맛이 진한 살짝 퓨전스런 닭도리탕인데요~ 정말 맛있어요👍🏼👍🏼👍🏼
0,서울특별시,중구,분식,별대봉식당,2021,7,5,5,5,5,너무 배고파서 사진을ㅜ 자주 주문할것 같아요~ 잘 먹었습니다^^
0,서울특별시,중구,분식,별대봉식당,2021,7,5,5,5,5,약간 맵긴 하지만 맛있었어요
0,서울특별시,중구,분식,별대봉식당,2021,7,4,5,5,4,16분에 온다면서요…
0,서울특별시,중구,분식,별대봉식당,2021,7,4,4,5,4,가성비가 아주 좋습니다
0,서울특별시,중구,분식,별대봉식당,2021,7,5,5,5,5,뭔말필요하나요? 개인적으로 대박나면 맛이다를까봐걱정돼요
0,서울특별시,중구,분식,별대봉식당,2021,7,5,5,5,5,양이 엄청 많아서 놀랐어요 맛있었요!! 추천합니다!
0,서울특별시,중구,분식,별대봉식당,2021,7,5,5,5,5,맛있게 잘먹었습니다
0,서울특별시,중구,분식,별대봉식당,2021,7,5,5,5,5,후회말고 이 시즌엔 매콤하고 영양만점 닭볶음탕을 드셔보시길 깜놀할겁니다 띠용~너무 맛있어서 오래오래 장사하세요 매번 너무 잘먹고있어요
0,서울특별시,중구,분식,별대봉식당,2021,7,3,5,5,3,맛은 정말 맛있었는데..먹던 와중에 저 빵끈같은게 나왔어요..ㅠ 배달도 늦으시구ㅜㅜ 많이 기대하면서 먹었는데 좀 아쉽네요 맛은 있었습니다 ㅠ
0,서울특별시,중구,분식,별대봉식당,2021,7,5,5,5,5,"#식후감 정말 언제 시켜먹어도 너무너무 맛있어서 닭도리탕이 생각나면 자연스레 주문하게 되는 집이에요! 이 집의 시그니처인 스팸통짜구이도, 그리고 서비스들도 너무 맛있구 무엇보다 메인인 닭도리탕은.. 진짜 입에서 살살 녹읍니다... 미리 차게 해둔 소주 한 잔 먹고 포슬포슬한 감자 반쯤 잘라 야들야들한 닭고기와 걸쭉한 국물 함께 한 입 하면 정말 이리 많은 양이 줄어드는게 눈에 보일 정도로 게눈 감추듯 먹게 되더라구요 그리고 추가한 당면 사리는 꼬들꼬들해서 정말 최고입니다 오늘도 맛있게 잘 먹었어요! 항상 감사합니다 ㅎㅎ"
0,서울특별시,중구,분식,별대봉식당,2021,7,5,5,5,5,"메모와함께 정성스레 배달되어왔습니다, 만두 서비스 정말 감사합니다, 간장이 같이왔으면 더 좋았겠어요ㅎ"
0,서울특별시,중구,분식,별대봉식당,2021,7,5,3,5,5,생각보다 매콤해서 여자친구가 먹다가 포기했어요 매운 걸 거의 못먹거든요 저번에 ㅂH민으로 주문했을때보다 옛날도시락이 짰어요
0,서울특별시,중구,분식,별대봉식당,2021,7,5,5,5,5,짜글이가 너무 땡겨서 시켰는데 너무양이 많아서 낼 아침도 짜글이먹어야겠어요 2인분이 아니라 3-4인분은 될거같아요 양많다는 리뷰보고 많아야 얼마나 많겠나 했는데 배터지겠요...ㅎㅎ 진짜 맛있고 양많고 좋아요😄
0,서울특별시,중구,분식,별대봉식당,2021,7,4,5,5,3,주문하고 조금 다르게와서 아쉽습니다. 맛은있어요!
0,서울특별시,중구,분식,별대봉식당,2021,7,5,5,5,5,진짜 1인메뉴 2인메뉴 다 맛있네요...양도 서비스도 좋습니다..허허
0,서울특별시,중구,분식,별대봉식당,2021,7,5,5,5,5,"배송 조금 늦는다고 연락도해주시고, 음식은 따뜻하고, 양도 많고 맛있어요."
0,서울특별시,중구,분식,별대봉식당,2021,7,5,5,5,5,존맛탬~~~~~~~
0,서울특별시,중구,분식,별대봉식당,2021,7,5,5,5,5,있었는데요없습니다
0,서울특별시,중구,분식,별대봉식당,2021,7,5,5,5,5,항상 맛있게 요리해주셔서 감사합니다
0,서울특별시,중구,분식,별대봉식당,2021,7,5,5,5,5,"타임딜 주문실수로 놓치고 다시 주문해서 아시웠지만, 그 이상으로 푸짐하고 맛있었어요"
0,서울특별시,중구,분식,별대봉식당,2021,7,5,5,5,5,맛있어요~ 양도많음
0,서울특별시,중구,분식,별대봉식당,2021,7,5,5,5,5,항상 잘 먹고 있습니다.
0,서울특별시,중구,분식,별대봉식당,2021,7,5,5,5,5,양 맛 좋아요 많이 시키세요
0,서울특별시,중구,분식,별대봉식당,2021,7,5,5,5,5,맛있게 잘먹었습니다
0,서울특별시,중구,분식,별대봉식당,2021,7,5,5,5,5,맛있게 잘 먹었어요~
0,서울특별시,중구,분식,별대봉식당,2021,7,5,5,5,5,"진짜진짜 푸짐하고 맛있게 먹었어요~ 둘이 먹고도 남아서 다음날에 남은 닭에 살발라서 밥비벼 먹으니 이 또한 별미네요~!!!! 양도 많고, 맛도 있고~ 앞으로 닭볶음탕은 별대봉 식당으로 정착할거에요~^-^"
0,서울특별시,중구,분식,별대봉식당,2021,7,5,5,5,5,너무너무 맛있었습니다. 배고파서 먹고 보니 사진을 찍지 못했어요 다음번에는 찍어서 올려드릴게요^^
0,서울특별시,중구,분식,별대봉식당,2021,7,5,5,5,5,생각나서 또 시켰습니다. 푸짐하고 맛있어서 만족스럽습니다
0,서울특별시,중구,분식,별대봉식당,2021,7,5,5,5,5,"배송도빠르고,, 양도 많고, 맛도있네요~~"
0,서울특별시,중구,분식,별대봉식당,2021,7,5,5,5,5,삼겹짜글이도 맛나네요!
0,서울특별시,중구,분식,별대봉식당,2021,7,5,5,5,5,양이 진짜 대박입니다..!!
0,서울특별시,중구,분식,별대봉식당,2021,7,5,5,5,5,맛있게 잘먹었습니다
0,서울특별시,중구,분식,별대봉식당,2021,7,5,5,5,5,항상 너무 맛있고 리뷰이벤트 감사합니다~!
0,서울특별시,중구,분식,별대봉식당,2021,7,5,5,4,4,여기서 두 번째 시켜먹는건데 역시 맛있고 푸짐해요 밥 두공기 뚝딱 하느라 배 불러 죽겐네여!!ㅠ
0,서울특별시,중구,분식,별대봉식당,2021,7,5,5,5,5,너무 맛있게 잘 먹었습니다
0,서울특별시,중구,분식,별대봉식당,2021,7,5,5,5,5,양도 많고 맛있어요
0,서울특별시,중구,분식,별대봉식당,2021,7,5,5,5,5,증맬로 맛있더라구요 포ㅠㅠㅠㅠ 또시켜야졍
0,서울특별시,중구,분식,별대봉식당,2021,7,5,5,5,5,너무 맛있어서 사진 찍는 것도 깜박했습니다. 처음 시켜먹었는데 너무 맛있습니다. 다음에 또 먹겠습니다!
0,서울특별시,중구,분식,별대봉식당,2021,7,5,5,5,5,맛있게 잘먹었습니다~
0,서울특별시,중구,분식,별대봉식당,2021,7,5,5,5,5,#식후감 #음식은접사 #존맛탱 서비스로 군만두도 두둑히 주시고 스팸도 한통씩 보내주셨습니다 매콤해서 잡내도 없고 고기도 부드러워서 할머님도 드실수 있습니다 고기아래에 당면이 깔려있는데 쫄깃하고 소스가 맛있어서 밥도둑이에요 남은 국물로 밥에 김가루뿌려서 비벼먹으면 환장의 콜라보👍 다섯명이서 2마리 시켜먹었는데 양도 만족 맛도 만족!!
0,서울특별시,중구,분식,별대봉식당,2021,7,5,5,5,5,약간의 카레 맛이 나고 맛있네요 ^^ (캔에 붙은 메모 떼기가 힘들어요ㅠ)
0,서울특별시,중구,분식,별대봉식당,2021,7,5,5,5,5,맛나고 양이 증말 푸짐 ㅎㅎ
0,서울특별시,중구,분식,별대봉식당,2021,7,5,5,5,5,맛있게 먹었습니다 사장님 더 장사 번창하시길 바랍니다
0,서울특별시,중구,분식,별대봉식당,2021,7,5,5,5,5,아 하도 많이 시켜먹어서 사진을 다른거 주문한거랑 헛갈려서 거기에 올려버렸네요 ㅠㅠ 아무튼 너무 맛있었어요 몃일 단위로 계속 시켜먹다가 보니까 리뷰를 헛갈리네요 ㅠ
0,서울특별시,중구,분식,별대봉식당,2021,7,5,5,5,5,맛잇게 먹겠습니다 비쥬얼도 굿 서비스도 굿 근데 수저가 없어요 ㅠㅠㅠㅠㅠㅠ
0,서울특별시,중구,분식,별대봉식당,2021,7,5,5,5,5,짜글이 처음 시켰는데 진짜 맛있네요. 입맛 없을 때 먹어도 최소 밥 두공기는 먹겠네요. 짜글이 외에도 다른 먹을거리가 있어서 만족스럽습니다
0,서울특별시,중구,분식,별대봉식당,2021,7,5,5,5,5,맛있습니다! 저번에 배달이 조금 아쉬웠는데 다시 시켰을땐 너무 좋았어요! 잘 먹었습니다!
0,서울특별시,중구,분식,별대봉식당,2021,7,5,5,5,5,"배달 빠르고, 맛 좋고 양도 충분합니다!! 늘 잘먹고 있습니다~"
0,서울특별시,중구,분식,별대봉식당,2021,7,5,5,5,5,맛있어요 다음에도 주문할게요
0,서울특별시,중구,분식,별대봉식당,2021,7,5,5,5,5,진짜 야밤에 최고의 선택...너무 맛있습니다
0,서울특별시,중구,분식,별대봉식당,2021,7,5,5,5,5,맛있어요 또 먹을게요 굿
0,서울특별시,중구,분식,별대봉식당,2021,7,1,1,1,1,도시락 비비려고 밥을들어서 비비던도중 이상한 털이 나왔네요 정말 맛있어서 좋아하는집인데 조금 실망스럽네요
0,서울특별시,중구,분식,별대봉식당,2021,7,5,5,5,5,너무맛있어서 다먹고도 리뷰올리고싶었어요 항상 맛있게 먹고있어요 배고팠는데 너무맛있어요 삼겹살도 많이들어있어서 푸짐하게 잘먹었어요 !!ㅎㅎㅎ
0,서울특별시,중구,분식,별대봉식당,2021,7,5,5,5,5,어맛. 여긴 먹어야햇!!!!
0,서울특별시,중구,분식,별대봉식당,2021,7,5,5,5,5,양도 많고 맛있어요
0,서울특별시,중구,분식,별대봉식당,2021,7,5,5,5,5,맛있게 잘목었습니다
0,서울특별시,중구,분식,별대봉식당,2021,7,5,5,5,5,닭도 엄청 야들야들하고 양념도 넘 맛있어요! 서비스로 주신 군만두도 맛있네요. 감사합니다. 복 많이 받으세요^^
0,서울특별시,중구,분식,별대봉식당,2021,7,5,5,5,5,맛있게 잘 먹었읍니다. 담에도 잘 부탁드려요
0,서울특별시,중구,분식,별대봉식당,2021,7,5,5,5,5,양이 진짜많은데 서비스까지 챙겨주시고.. ㅠ 배달초스피드 친절함까지!!
0,서울특별시,중구,분식,별대봉식당,2021,7,5,5,5,5,이 가격에 정말 다양한 구성에 물까지 주시다니요 넘 맛있게 잘 먹었습니당 배달도 빨리 왔어요!
